{
  "$schema": "../schema/project.schema.json",
  "slug": "flyers-maker",
  "title": "FlyerGen AI",
  "type": "web",
  "year": 2025,
  "featured": false,
  "status": "live",
  "duration": { "fr": "3 semaines", "en": "3 weeks" },
  "team": { "fr": "Projet solo", "en": "Solo project" },
  "headline": {
    "fr": "Créez des flyers professionnels en quelques clics, directement depuis le navigateur.",
    "en": "Create professional flyers in a few clicks, directly from the browser."
  },
  "description": {
    "fr": "Un outil web no-code pour concevoir, personnaliser et exporter rapidement des flyers et des visuels marketing, avec des modèles responsives et un export de haute qualité.",
    "en": "A no-code web tool for designing, customizing, and exporting flyers and marketing visuals quickly, with responsive templates and high-quality export."
  },
  "summary": {
    "fr": "FlyerGen AI permet aux petites entreprises et aux créateurs de produire des visuels marketing soignés sans compétences en design : modèles modulaires, éditeur en glisser-déposer et export PNG/PDF.",
    "en": "FlyerGen AI lets small businesses and creators produce polished marketing visuals without design skills: modular templates, drag-and-drop editor, and PNG/PDF export."
  },
  "problem": {
    "fr": "Les petites entreprises et les freelances manquent souvent de ressources pour produire des visuels marketing soignés et adaptables à différents formats.",
    "en": "Small businesses and freelancers often lack resources to produce polished, adaptable marketing visuals for different formats."
  },
  "solution": {
    "fr": "Un éditeur web simple d’utilisation qui combine des modèles professionnels, l’édition en temps réel et un export optimisé pour l’impression ou les réseaux sociaux.",
    "en": "An easy-to-use web editor combining professional templates, real-time editing, and optimized export for print or social media."
  },
  "role": {
    "fr": [
      "Design UI/UX et prototypage",
      "Développement frontend Next.js / TypeScript",
      "Intégration de l’IA Gemini / moteur d’export",
      "Déploiement et monitoring sur Vercel"
    ],
    "en": [
      "UI/UX design and prototyping",
      "Next.js / TypeScript frontend development",
      "Gemini AI integration / export engine",
      "Vercel deployment and monitoring"
    ]
  },
  "impact": {
    "fr": [
      "MVP lancé et déployé",
      "Adoption rapide par des micro-entrepreneurs et des associations locales",
      "Création d’un visuel marketing ramenée à quelques minutes"
    ],
    "en": [
      "MVP launched and deployed",
      "Quick adoption among micro-entrepreneurs and local associations",
      "Marketing visual creation reduced to minutes"
    ]
  },
  "features": {
    "fr": [
      "Bibliothèque de modèles modulaires",
      "Éditeur en glisser-déposer (texte, images, formes)",
      "Réglages typographiques et palette de couleurs",
      "Export PNG / PDF haute résolution aux dimensions personnalisées",
      "Aperçu mobile et recadrage pour les réseaux sociaux",
      "Partage des créations par lien public"
    ],
    "en": [
      "Library of modular templates",
      "Drag-and-drop editor (text, images, shapes)",
      "Typography adjustments and color palette",
      "PNG / PDF high-resolution export with custom dimensions",
      "Mobile preview and social media crop",
      "Public link sharing for designs"
    ]
  },
  "technologies": [
    "Next.js",
    "TypeScript",
    "Tailwind CSS",
    "Gemini API",
    "Vercel",
    "Firebase"
  ],
  "image": {
    "src": "/images/projects/flyers-maker.png",
    "width": 1920,
    "height": 1200,
    "alt": {
      "fr": "Écran de création de FlyerGen AI : formulaire avec titre, mots-clés et choix du style, à côté de l’aperçu d’un flyer généré par IA pour une fête traditionnelle à Douala",
      "en": "FlyerGen AI creation screen: form with title, keywords and style choice, next to the preview of an AI-generated flyer for a traditional festival in Douala"
    }
  },
  "links": {
    "live": "https://flyers-maker.vercel.app/",
    "store": null,
    "code": null
  }
}
